{
  "snapshotVersion": 1,
  "policySchemaVersion": "1.0",
  "policyEngineVersion": "1.0.4",
  "policyEngineFingerprint": "sha256:fc01eed19014b378a76413c5e93d3c4d2af37e92cbcae2602a75f55b353bc91b",
  "policies": [
    {
      "department": "risk-and-compliance",
      "slug": "ai-use-case-risk-intake",
      "name": "Triage enterprise AI use cases",
      "owner": "Enterprise Risk and AI Governance",
      "policyVersion": "1.0.4",
      "fingerprint": "sha256:4b6c8e0fc469ee6b2b2d89815e97b63a7c7555545a14f57646dabc65c0c46356",
      "behavior": {
        "actions": [
          "Create an entry in the AI use-case inventory",
          "Assign security, privacy, legal, and risk reviewers from matched policy reasons",
          "Require a named approver before production or customer-facing use"
        ],
        "decisions": {
          "high": "hold_for_ai_governance_approval",
          "low": "approve_controlled_pilot",
          "medium": "require_cross_functional_review"
        },
        "department": "risk-and-compliance",
        "inputSchema": {
          "additionalProperties": true,
          "properties": {
            "approvedProvider": {
              "type": "boolean"
            },
            "businessOwner": {
              "maxLength": 500,
              "minLength": 1,
              "type": "string"
            },
            "businessPurpose": {
              "maxLength": 500,
              "minLength": 1,
              "type": "string"
            },
            "consequentialDecision": {
              "type": "boolean"
            },
            "customerFacing": {
              "type": "boolean"
            },
            "handlesSensitiveData": {
              "type": "boolean"
            },
            "humanReviewPlanned": {
              "type": "boolean"
            },
            "regulatedProcess": {
              "type": "boolean"
            },
            "requestId": {
              "maxLength": 500,
              "minLength": 1,
              "type": "string"
            },
            "useCaseName": {
              "maxLength": 500,
              "minLength": 1,
              "type": "string"
            }
          },
          "required": [
            "requestId",
            "useCaseName",
            "businessOwner",
            "businessPurpose"
          ],
          "type": "object"
        },
        "policyEngineVersion": "1.0.4",
        "policySchemaVersion": "1.0",
        "rules": [
          {
            "field": "handlesSensitiveData",
            "operator": "truthy",
            "points": 35,
            "reason": "Use case handles sensitive data"
          },
          {
            "field": "customerFacing",
            "operator": "truthy",
            "points": 25,
            "reason": "AI output is customer-facing"
          },
          {
            "field": "consequentialDecision",
            "minimumBand": "high",
            "operator": "truthy",
            "points": 70,
            "reason": "AI contributes to a consequential decision"
          },
          {
            "field": "regulatedProcess",
            "minimumBand": "high",
            "operator": "truthy",
            "points": 50,
            "reason": "Use case operates within a regulated process"
          },
          {
            "field": "approvedProvider",
            "operator": "falsy",
            "points": 45,
            "reason": "Model or service provider is not approved"
          },
          {
            "field": "humanReviewPlanned",
            "operator": "falsy",
            "points": 35,
            "reason": "Human review is not part of the operating design"
          }
        ],
        "slug": "ai-use-case-risk-intake",
        "thresholds": {
          "high": 70,
          "medium": 30
        }
      }
    },
    {
      "department": "marketing",
      "slug": "campaign-lead-compliance-gate",
      "name": "Gate campaign leads for compliant follow-up",
      "owner": "Marketing Operations",
      "policyVersion": "1.0.4",
      "fingerprint": "sha256:541b099f3ef285dbe060625d4a05b0bfd79eee090cbc4d82741f01cc94034822",
      "behavior": {
        "actions": [
          "Record the policy decision",
          "Send approved contacts to the campaign sequence",
          "Route uncertain consent records to a human reviewer"
        ],
        "decisions": {
          "high": "suppress_automated_outreach",
          "low": "allow_campaign_follow_up",
          "medium": "route_to_compliance_review"
        },
        "department": "marketing",
        "inputSchema": {
          "additionalProperties": true,
          "properties": {
            "campaignId": {
              "maxLength": 500,
              "minLength": 1,
              "type": "string"
            },
            "consent": {
              "type": "boolean"
            },
            "country": {
              "maxLength": 500,
              "minLength": 1,
              "type": "string"
            },
            "email": {
              "format": "email",
              "maxLength": 320,
              "minLength": 3,
              "type": "string"
            },
            "engagementScore": {
              "maximum": 100,
              "minimum": 0,
              "type": "number"
            },
            "existingCustomer": {
              "type": "boolean"
            },
            "leadId": {
              "maxLength": 500,
              "minLength": 1,
              "type": "string"
            },
            "suppressed": {
              "type": "boolean"
            },
            "targetAccount": {
              "type": "boolean"
            }
          },
          "required": [
            "leadId",
            "email",
            "campaignId",
            "country"
          ],
          "type": "object"
        },
        "policyEngineVersion": "1.0.4",
        "policySchemaVersion": "1.0",
        "rules": [
          {
            "field": "consent",
            "minimumBand": "high",
            "operator": "falsy",
            "points": 60,
            "reason": "Consent is missing"
          },
          {
            "field": "suppressed",
            "minimumBand": "high",
            "operator": "truthy",
            "points": 80,
            "reason": "Contact is on a suppression list"
          },
          {
            "field": "targetAccount",
            "operator": "truthy",
            "points": -20,
            "reason": "Contact belongs to a target account"
          },
          {
            "field": "engagementScore",
            "operator": "gte",
            "points": -15,
            "reason": "Strong engagement signal",
            "value": 70
          },
          {
            "field": "existingCustomer",
            "operator": "truthy",
            "points": 15,
            "reason": "Customer messaging policy may apply"
          }
        ],
        "slug": "campaign-lead-compliance-gate",
        "thresholds": {
          "high": 70,
          "medium": 30
        }
      }
    },
    {
      "department": "legal",
      "slug": "contract-intake-routing",
      "name": "Route enterprise contract requests",
      "owner": "Legal Operations",
      "policyVersion": "1.0.4",
      "fingerprint": "sha256:10aa36610499497f0a32bbad3c29e3b77ff22b46c206dfdcd44d7966de896b13",
      "behavior": {
        "actions": [
          "Create the legal matter",
          "Attach the structured intake fields",
          "Require legal approval before signature or redline acceptance"
        ],
        "decisions": {
          "high": "open_cross_functional_review",
          "low": "use_standard_legal_queue",
          "medium": "assign_specialist_review"
        },
        "department": "legal",
        "inputSchema": {
          "additionalProperties": true,
          "properties": {
            "autoRenewal": {
              "type": "boolean"
            },
            "contractType": {
              "maxLength": 500,
              "minLength": 1,
              "type": "string"
            },
            "contractValue": {
              "minimum": 0,
              "type": "number"
            },
            "counterparty": {
              "maxLength": 500,
              "minLength": 1,
              "type": "string"
            },
            "crossBorderData": {
              "type": "boolean"
            },
            "nonStandardTerms": {
              "type": "boolean"
            },
            "personalData": {
              "type": "boolean"
            },
            "regulatedIndustry": {
              "type": "boolean"
            },
            "requestId": {
              "maxLength": 500,
              "minLength": 1,
              "type": "string"
            }
          },
          "required": [
            "requestId",
            "contractType",
            "counterparty",
            "contractValue"
          ],
          "type": "object"
        },
        "policyEngineVersion": "1.0.4",
        "policySchemaVersion": "1.0",
        "rules": [
          {
            "field": "nonStandardTerms",
            "operator": "truthy",
            "points": 30,
            "reason": "Non-standard terms requested"
          },
          {
            "field": "personalData",
            "operator": "truthy",
            "points": 25,
            "reason": "Agreement involves personal data"
          },
          {
            "field": "crossBorderData",
            "operator": "truthy",
            "points": 30,
            "reason": "Cross-border data transfer involved"
          },
          {
            "field": "autoRenewal",
            "operator": "truthy",
            "points": 15,
            "reason": "Automatic renewal clause present"
          },
          {
            "field": "regulatedIndustry",
            "operator": "truthy",
            "points": 30,
            "reason": "Counterparty operates in a regulated industry"